{
  "$schema": "https://json-schema.org/draft/2020-12/schema",
  "$id": "https://workflowhub.local/runtime/schemas/skill-bundle.schema.json",
  "type": "object",
  "required": ["schema_version", "skill", "files"],
  "properties": {
    "schema_version": { "const": 1 },
    "skill": { "type": "string", "minLength": 1 },
    "contract": { "type": "string", "minLength": 1 },
    "contract_owner": { "type": "string", "minLength": 1 },
    "runner_contract_major": { "type": "integer", "minimum": 1 },
    "runner_contract_min_minor": { "type": "integer", "minimum": 0 },
    "runtime_dependencies": {
      "type": "array",
      "items": {
        "type": "object",
        "required": ["name", "version", "source"],
        "properties": {
          "name": { "type": "string", "minLength": 1 },
          "version": { "type": "string", "minLength": 1 },
          "source": { "type": "string", "minLength": 1 }
        },
        "additionalProperties": false
      }
    },
    "files": {
      "type": "array",
      "minItems": 1,
      "items": {
        "oneOf": [
          { "type": "string", "minLength": 1 },
          {
            "type": "object",
            "required": ["path"],
            "properties": {
              "path": { "type": "string", "minLength": 1 },
              "sha256": { "type": "string", "pattern": "^[a-f0-9]{64}$" }
            },
            "additionalProperties": false
          }
        ]
      }
    },
    "portable_workflows": {
      "type": "array",
      "items": {
        "type": "object",
        "required": ["component_id", "workflow", "kind", "path", "files"],
        "properties": {
          "component_id": { "const": "build-prd" },
          "workflow": { "const": "build-prd" },
          "kind": { "const": "portable_workflow" },
          "path": { "const": "workflows/build-prd/SKILL.md" },
          "files": {
            "const": [
              "workflows/build-prd/SKILL.md",
              "workflows/build-prd/skill-deps.yaml",
              "workflows/build-prd/steps.json"
            ]
          }
        },
        "additionalProperties": false
      },
      "minItems": 1,
      "maxItems": 1
    },
    "sources": {
      "type": "array",
      "items": { "oneOf": [
        {
          "type": "object",
          "required": ["url", "commit", "path", "license", "adopted"],
          "properties": {
            "url": { "type": "string", "pattern": "^https://github\\.com/" },
            "commit": { "type": "string", "pattern": "^[a-f0-9]{40}$" },
            "path": { "type": "string", "minLength": 1 },
            "license": { "type": "string", "minLength": 1 },
            "adopted": { "type": "array", "minItems": 1, "items": { "type": "string", "minLength": 1 } },
            "content_sha256": { "type": ["string", "null"], "pattern": "^[a-f0-9]{64}$" }
          },
          "$comment": "Complete facts belong to catalog; adopted names source sections and local adoption. content_sha256 is only for genuinely vendored bytes; null is unmeasured. Default hashing/writeback is deferred to N10.",
          "additionalProperties": false
        },
        {
          "type": "object",
          "required": ["kind", "path", "license", "authorization_basis", "reviewed_at", "review_outcome"],
          "$comment": "Local sources retain authorization; absent snapshot_sha256 is unknown, never a Git commit.",
          "properties": {
            "kind": { "const": "user-provided-local-source" },
            "path": { "type": "string", "minLength": 1 },
            "license": { "type": "string", "minLength": 1 },
            "snapshot_sha256": { "type": "string", "pattern": "^[a-f0-9]{64}$" },
            "authorization_basis": { "type": "string", "minLength": 1 },
            "reviewed_at": { "type": "string", "format": "date" },
            "review_outcome": { "enum": ["accepted", "rejected", "watch"] }
          },
          "additionalProperties": false
        },
        {
          "type": "object",
          "required": ["path"],
          "properties": { "path": { "type": "string", "pattern": "^\\.\\./catalog\\.yaml#skills\\.[a-z0-9][a-z0-9-]*$" } },
          "additionalProperties": false,
          "$comment": "Non-authoritative pointer relative to skills/<name>/. A copied skill may lack catalog; SKILL.md retains source names/retrieval clues, never a second registration."
        }
      ] }
    }
  },
  "additionalProperties": false,
  "allOf": [
    {
      "if": { "properties": { "skill": { "const": "workflowhub" } }, "required": ["skill"] },
      "then": {
        "required": ["runner_contract_major", "runner_contract_min_minor", "portable_workflows"]
      }
    }
  ]
}
