{
  "schema_version": 1,
  "skill": "frontend-component-quality",
  "files": [
    "SKILL.md",
    "scripts/check-frontend-component-quality.mjs",
    "upstream/react-best-practices/AGENTS.md",
    "upstream/react-best-practices/LICENSE",
    "upstream/react-best-practices/UPSTREAM.md"
  ],
  "sources": [
    {
      "path": "../catalog.yaml#skills.frontend-component-quality"
    }
  ]
}
